"stnid","stname","lat","lon","address","city","state"
"949390-99999","MONTAGUE ISLAND LIGHHOUSE",-36.25,150.217,"New South Wales, Australia","New South Wales","New South Wales"
"949410-99999","BATEMANS BAY (CATALINA COUNTRY CLUB)",-35.733,150.183,"Vista Avenue, Catalina, Eurobodalla Shire Council, New South Wales, 2536, Australia","Vista Avenue","New South Wales"
"949430-99999","NERRIGA AWS",-35.117,150.083,"Nerriga Road, Nerriga, Queanbeyan-Palerang Regional Council, New South Wales, 2622, Australia","Nerriga Road","New South Wales"
"949490-99999","HOGAN ISLAND",-39.217,146.983,"Flinders Council, Tasmania, Australia","Flinders Council","Tasmania"
"949500-99999","MARRAWAH",-40.917,144.7,"Harcus River Road, Marrawah, Circular Head, Tasmania, 7330, Australia","Harcus River Road","Tasmania"
"949510-99999","DUNALLEY (STROUD POINT)",-42.9,147.783,"Dunalley, Sorell, Tasmania, 7177, Australia","Dunalley","Tasmania"
"949530-99999","SMITHTON AERODROME",-40.833,145.083,"Smithton Airport, Mella Road, Broadmeadows, Smithton, Circular Head, Tasmania, 7330, Australia","Smithton Airport","Tasmania"
"949540-99999","CAPE GRIM BAPS",-40.667,144.683,"Tasmania, Australia","Tasmania","Tasmania"
"949550-99999","SHEFFIELD SCHOOL FARM",-41.383,146.317,"West Kentish Road, Sheffield, Kentish, Tasmania, 7306, Australia","West Kentish Road","Tasmania"
"949560-99999","STRAHAN AERODROME",-42.15,145.283,"Ocean Beach Road, Strahan, West Coast, Tasmania, 7468, Australia","Ocean Beach Road","Tasmania"
"949570-99999","OUSE FIRE STATION",-42.483,146.717,"Ouse Golf Course, Tor Hill Road, Ouse, Central Highlands, Tasmania, 7140, Australia","Ouse Golf Course","Tasmania"
"949590-99999","BUTLERS GORGE",-42.283,146.283,"Central Highlands, Tasmania, Australia","Central Highlands","Tasmania"
"949600-99999","TUNNAK FIRE STATION",-42.45,147.467,"Tunnack Road, Baden, Parattah, Southern Midlands, Tasmania, 7120, Australia","Tunnack Road","Tasmania"
"949610-99999","DOVER",-43.317,147.017,"Bay View Road, Dover, Huon Valley, Tasmania, 7117, Australia","Bay View Road","Tasmania"
"949620-99999","MAATSUYKER ISLAND LIGHTHOUSE",-43.65,146.267,"Tasmania, Australia","Tasmania","Tasmania"
"949630-99999","MAYDENA POST OFFICE",-42.75,146.617,"Junee Road, Maydena, Derwent Valley, Tasmania, 7140, Australia","Junee Road","Tasmania"
"949640-99999","BUSHY PARK (BUSHY PARK ESTATES)",-42.717,146.9,"Glenora Road, Bushy Park, Derwent Valley, Tasmania, 7140, Australia","Glenora Road","Tasmania"
"949670-99999","CAPE BRUNY LIGHTHOUSE",-43.5,147.15,"Tasmania, Australia","Tasmania","Tasmania"
"949680-99999","LAUNCESTON",-41.545,147.214,"Launceston Airport, 201, Evandale Road, Western Junction, Northern Midlands, Tasmania, 7212, Australia","Launceston Airport","Tasmania"
"949690-99999","LAUNCESTON (TI TREE BEND)",-41.417,147.117,"West Tamar Trail, Trevallyn, Launceston, West Tamar, Tasmania, 7248, Australia","West Tamar Trail","Tasmania"
"949700-99999","HOBART (ELLERSLIE ROAD)",-42.883,147.333,"Mawson Place, Hobart, City of Hobart, Tasmania, 7000, Australia","Mawson Place","Tasmania"
"949710-99999","MELTON MOWBRAY (NORTH STOCKMAN)",-42.5,147.2,"Kempton, Southern Midlands, Tasmania, 7030, Australia","Kempton","Tasmania"
"949720-99999","SCOTTSDALE ( WEST MINSTONE ROAD)",-41.167,147.483,"Scottsdale, Dorset, Tasmania, 7260, Australia","Scottsdale","Tasmania"
"949740-99999","CAPE SORELL",-42.199,145.17,"Lighthouse Cape Sorell, Macquarie Heads, West Coast, Tasmania, Australia","Lighthouse Cape Sorell","Tasmania"
"949750-99999","HOBART",-42.836,147.51,"Hobart Airport, 6, Hinkler Road, Cambridge, Hobart, City of Clarence, Tasmania, 7170, Australia","Hobart Airport","Tasmania"
"949760-99999","LAKE ST. CLAIR (NATIONAL PARK)",-42.117,146.167,"Mount Rufus Circuit, Watersmeet, Lake St Clair, Central Highlands, Tasmania, Australia","Mount Rufus Circuit","Tasmania"
"949770-99999","HARTZ MOUNTAINS",-43.2,146.767,"Keoghs Pimple Track, Huon Valley, Tasmania, Australia","Keoghs Pimple Track","Tasmania"
"949790-99999","LAKE LEAKE (ELIZABETH RIVER)",-42,147.783,"Lake Leake, Northern Midlands, Tasmania, 7210, Australia","Lake Leake","Tasmania"
"949800-99999","FLINDERS ISLAND AIRPORT",-40.1,148,"Whitemark, Flinders Council, Tasmania, 7255, Australia","Whitemark","Tasmania"
"949810-99999","SWANSEA (FRANCIS ST)",-42.133,148.067,"Gordon Street, Swansea, Glamorgan-Spring Bay, Tasmania, 7190, Australia","Gordon Street","Tasmania"
"949830-99999","LARAPUNA (EDDYSTONE POINT)",-41,148.35,"Tasmania, Australia","Tasmania","Tasmania"
"949850-99999","ROSS (THE BOULEVARDS)",-42.033,147.5,"Waterloo Street, Ross, Northern Midlands, Tasmania, 7209, Australia","Waterloo Street","Tasmania"
"949870-99999","FRIENDLY BEACHES",-42,148.283,"Friendly Beaches Road, Friendly Beaches, Glamorgan-Spring Bay, Tasmania, 7215, Australia","Friendly Beaches Road","Tasmania"
"949880-99999","DENNES POINT",-43.067,147.35,"Nebraska Road, Dennes Point, Kingborough, Tasmania, 7150, Australia","Nebraska Road","Tasmania"
"949950-99999","LORD HOWE ISLAND AERO",-31.542,159.079,"Lord Howe Island Airport, Airport Road, Lord Howe Island, Unincorporated New South Wales, New South Wales, 2898, Australia","Lord Howe Island Airport","New South Wales"
"949970-99999","HEARD ISLAND (THE SPIT)",-53.1,73.717,"Oil Barrel Point, Heard Island and McDonald Islands, Australia","Oil Barrel Point","Heard Island and McDonald Islands"
"949980-99999","MACQUARIE ISLAND",-54.499,158.937,"Razorbacks Tourist Lookout Track, Huon Valley, Tasmania, Australia","Razorbacks Tourist Lookout Track","Tasmania"
"951010-99999","TRUSCOTT",-14.083,126.383,"Haul Road, Mitchell Plateau, Shire Of Wyndham-East Kimberley, Western Australia, Australia","Haul Road","Western Australia"
"951110-99999","PORT KEATS AIRPORT",-14.25,129.533,"Nilinh, Wadeye, West Daly Region, Northern Territory, Australia","Nilinh","Northern Territory"
"951210-99999","MIDDLE POINT AWS",-12.6,131.3,"Anzac Parade, Middle Point, Litchfield Municipality, Northern Territory, 0822, Australia","Anzac Parade","Northern Territory"
"951420-99999","MANINGRIDA AERO",-12.05,134.233,"Maningrida, West Arnhem Region, Northern Territory, Australia","Maningrida","Northern Territory"
"951460-99999","NGAYAWILI",-12,135.567,"East Arnhem, East Arnhem Region, Northern Territory, 0852, Australia","East Arnhem","Northern Territory"
"952040-99999","WEST ROEBUCK",-17.9,122.317,"Roebuck, Shire Of Broome, Western Australia, 6725, Australia","Roebuck","Western Australia"
"952050-99999","DERBY AERO",-17.367,123.667,"Airport Road, Derby, Shire Of Derby-West Kimberley, Western Australia, Australia","Airport Road","Western Australia"
"952140-99999","WYNDHAM AERO",-15.5,128.15,"Arthur Road, Wyndham, Shire Of Wyndham-East Kimberley, Western Australia, Australia","Arthur Road","Western Australia"
"952830-99999","COOKTOWN AIRPORT",-15.45,145.183,"Cooktown Airport Road, Cooktown, Marton, Cook Shire, Queensland, 4895, Australia","Cooktown Airport Road","Queensland"
"952840-99999","WALKAMIN DPI",-17.133,145.433,"Walkamin, Tablelands Regional, Queensland, 4872, Australia","Walkamin","Queensland"
"952860-99999","MAREEBA AIRPORT AWS",-17.067,145.433,"Kennedy Highway, Mareeba, Mareeba Shire, Queensland, 4880, Australia","Kennedy Highway","Queensland"
"952880-99999","BOUGAINVILLE REEF",-15.5,147.117,NA,NA,NA
"952910-99999","INGHAM COMPOSITE",-18.65,146.183,"Victoria Mill Road, Victoria Plantation, Ingham, Hinchinbrook Shire, Queensland, Australia","Victoria Mill Road","Queensland"
"952920-99999","SOUTH JOHNSTONE EXP STN",-17.6,146,"South Johnstone Road, Boogan, South Johnstone, Cassowary Coast Regional, Queensland, Australia","South Johnstone Road","Queensland"
"952930-99999","WOOLSHED",-19.417,146.533,"Hervey Range, Charters Towers Regional, Queensland, 4817, Australia","Hervey Range","Queensland"
"952950-99999","AYR DPI RESEARCH STN",-19.617,147.383,"Webber Road, McDesme, Ayr, Burdekin Shire, Queensland, 4807, Australia","Webber Road","Queensland"
"952960-99999","AYR ALVA BEACH",-19.45,147.483,"Sandowns Street, Alva, Burdekin Shire, Queensland, Australia","Sandowns Street","Queensland"
"953030-99999","VARANUS ISLAND",-20.65,115.567,"Shire Of Ashburton, Western Australia, Australia","Shire Of Ashburton","Western Australia"
"953040-99999","BARROW ISLAND AIRPORT",-20.883,115.4,"Barrow Island, Shire Of Ashburton, Western Australia, Australia","Barrow Island","Western Australia"
"953050-99999","ONSLOW AIRPORT",-21.667,115.117,"YOLW, Onslow Airport Road, Onslow, Shire Of Ashburton, Western Australia, 6710, Australia","YOLW","Western Australia"
"953070-99999","KARRATHA AERO",-20.717,116.767,"Karasek Way, Gap Ridge, Karratha, City Of Karratha, Western Australia, Australia","Karasek Way","Western Australia"
"953170-99999","MARBLE BAR",-21.183,119.75,"Corunna Downs Road, Marble Bar, Shire of East Pilbara, Western Australia, 6760, Australia","Corunna Downs Road","Western Australia"
"953220-99999","RABBIT FLAT",-20.183,130.017,"Rabbit Flat, Tanami, Central Desert Region, Northern Territory, 0872, Australia","Rabbit Flat","Northern Territory"
"953230-99999","ARLTUNGA",-23.467,134.683,"Arltunga Road, Hale, Macdonnell Region, Central Desert Region, Northern Territory, Australia","Arltunga Road","Northern Territory"
"953510-99999","BLACKALL AIRPORT",-24.417,145.433,"Landsborough Highway, Blackall, Blackall Tambo Regional, Queensland, Australia","Landsborough Highway","Queensland"
"953620-99999","SPRINGSURE DAME ST",-24.117,148.083,"Springsure, Central Highlands Regional, Queensland, 4722, Australia","Springsure","Queensland"
"953670-99999","MACKAY AERO",-21.167,149.183,"Mackay Airport, Bluewater Trail, South Mackay, Mackay, Mackay Regional, Queensland, 4740, Australia","Mackay Airport","Queensland"
"953690-99999","ST LAWRENCE",-22.35,149.517,"St Lawrence Recreational Reserve, Saint Lawrence Connection Road, St Lawrence, Isaac Regional, Queensland, Australia","St Lawrence Recreational Reserve","Queensland"
"953700-99999","WILLIAMSON",-22.47,150.18,"Williamson Airfield, North South Road, Shoalwater, Livingstone Shire, Queensland, Australia","Williamson Airfield","Queensland"
"954020-99999","SHARK BAY AIRPORT",-25.9,113.583,"Francois Peron National Park, Shire Of Shark Bay, Western Australia, 6537, Australia","Francois Peron National Park","Western Australia"
"954480-99999","LEINSTER AERO",-27.85,120.7,"Leinster, Shire Of Leonora, Western Australia, 6437, Australia","Leinster","Western Australia"
"954580-99999","COOBER PEDY AIRPORT",-29.033,134.717,"Coober Pedy, The District Council of Coober Pedy, South Australia, 5723, Australia","Coober Pedy","South Australia"
"954800-99999","MARREE AERO",-29.667,138.067,"Marree Station, Pastoral Unincorporated Area, South Australia, 5733, Australia","Marree Station","South Australia"
"954810-99999","MOOMBA AIRPORT",-28.1,140.2,"Bonython Road, Gidgealpa, Pastoral Unincorporated Area, South Australia, 5731, Australia","Bonython Road","South Australia"
"954820-99999","BIRDSVILLE",-25.898,139.348,"MacDonald Street, Birdsville, Diamantina Shire, Queensland, Australia","MacDonald Street","Queensland"
"954850-99999","TIBOOBURRA",-29.451,142.058,"Airport Road, Tibooburra, Unincorporated Far West Area, New South Wales, 2880, Australia","Airport Road","New South Wales"
"954870-99999","BALLERA GAS FIELD",-27.417,141.817,"Durham, Bulloo Shire, Queensland, 4492, Australia","Durham","Queensland"
"954920-99999","THARGOMINDAH",-27.986,143.811,"Thargomindah Airport, Frew Street, Thargomindah, Bulloo Shire, Queensland, Australia","Thargomindah Airport","Queensland"
"955120-99999","BREWARRINA HOSPITAL",-29.95,146.85,"Brewarrina, Brewarrina Shire Council, New South Wales, 2839, Australia","Brewarrina","New South Wales"
"955200-99999","COLLARENBRI (ALBERT STREET)",-29.55,148.583,"Gwydir Highway, Collarenebri, Walgett Shire Council, New South Wales, 2833, Australia","Gwydir Highway","New South Wales"
"955270-99999","MOREE AERO",-29.491,149.846,"Blueberry Road, Moree, Moree Plains Shire Council, New South Wales, 2400, Australia","Blueberry Road","New South Wales"
"955290-99999","MILES CONSTANCE STREET",-26.65,150.183,"Miles State High School, Edith Street, Miles, Western Downs Regional, Queensland, 4415, Australia","Miles State High School","Queensland"
"955330-99999","TEXAS POST OFFICE",-28.85,151.167,"Kemp Street, Texas, Goondiwindi Regional, Queensland, Australia","Kemp Street","Queensland"
"955410-99999","INVERELL (RAGLAN ST)",-29.783,151.117,"Medora Street, Inverell, Inverell Shire Council, New South Wales, 2360, Australia","Medora Street","New South Wales"
"955430-99999","GAYNDAH AIRPORT",-25.617,151.617,"Gayndah Airport, John Taylors Road, Gayndah, North Burnett Regional, Queensland, Australia","Gayndah Airport","Queensland"
"955510-99999","TOOWOOMBA AIRPORT",-27.55,151.917,"Greenwattle Street, Wilsonton, Toowoomba, Toowoomba Regional, Queensland, 4350, Australia","Greenwattle Street","Queensland"
"955650-99999","HERVEY BAY AIRPORT",-25.317,152.883,"John Duigan Drive, Urangan, Hervey Bay, Fraser Coast Regional, Queensland, 4655, Australia","John Duigan Drive","Queensland"
"955660-99999","BEERBURRUM FOREST STATION",-26.95,152.967,"Rapkins Road, Beerburrum, Sunshine Coast Regional, Queensland, 4518, Australia","Rapkins Road","Queensland"
"955700-99999","GRAFTON AIRPORT",-29.75,153.033,"Clarence Valley Regional Airport, Airport Road, Glenugie, Grafton, Clarence Valley Council, New South Wales, 2460, Australia","Clarence Valley Regional Airport","New South Wales"
"955710-99999","GRAFTON RESEARCH STN",-29.617,152.967,"Experiment Farm Road, Grafton, Clarence Valley Council, New South Wales, Australia","Experiment Farm Road","New South Wales"
"955720-99999","NAMBOUR DPI-HILLSIDE",-26.65,152.933,"Towen Mount Road, Towen Mountain, Sunshine Coast Regional, Queensland, 4560, Australia","Towen Mount Road","Queensland"
"955750-99999","BEAUDESERT DRUMLEY ST",-27.967,152.983,"Wallace Way, Gleneagle, Beaudesert, Scenic Rim Regional, Queensland, 4285, Australia","Wallace Way","Queensland"
"955810-99999","LONGAN CITY WATER TREATMENT",-27.7,153.2,"6, Eagle Drive, Eagleby, Greater Brisbane, Queensland, 4129, Australia","Eagle Drive","Queensland"
"955910-99999","REDCLIFFE",-27.217,153.1,"Fleetwing Avenue, Newport, Greater Brisbane, City of Moreton Bay, Queensland, 4020, Australia","Fleetwing Avenue","Queensland"
"956000-99999","JURIEN BAY",-30.3,115.033,"Turquose Way Trail, Jurien Bay, Shire Of Dandaragan, Western Australia, 6516, Australia","Turquose Way Trail","Western Australia"
"956020-99999","BUSSELTON JETTY",-33.633,115.333,"Busselton, City Of Busselton, Western Australia, Australia","Busselton","Western Australia"
"956030-99999","KELLERBERRIN",-31.617,117.717,"Kellerberrin Airport, Dowding Street, Kellerberrin, Shire Of Kellerberrin, Western Australia, 6410, Australia","Kellerberrin Airport","Western Australia"
"956040-99999","GOSNELLS CITY",-32.05,115.983,"Armadale Railway PSP, Maddington, City of Gosnells, Western Australia, 6109, Australia","Armadale Railway PSP","Western Australia"
"956060-99999","LANCELIN",-31.017,115.317,"Western Australia, Australia","Western Australia","Western Australia"
"956070-99999","GARDEN ISLAND HSF",-32.233,115.683,"Dampier Road, HMAS Stirling, City of Rockingham, Western Australia, Australia","Dampier Road","Western Australia"
"956100-99999","KALAMUNDA BICKLEY",-32.017,116.133,"Walnut Road, Pickering Brook, City Of Kalamunda, Western Australia, Australia","Walnut Road","Western Australia"
"956110-99999","BUSSELTON AERO",-33.683,115.4,"Busselton Margaret River Airport, 86, Neville Hyder Drive, Yalyalup, City Of Busselton, Western Australia, 6280, Australia","Busselton Margaret River Airport","Western Australia"
"956120-99999","GINGIN AERO",-31.467,115.867,"Duffy Road, Yeal, Shire Of Gingin, Western Australia, Australia","Duffy Road","Western Australia"
"956130-99999","PEMBERTON",-34.45,116.033,"Dickensen Street, Pemberton, Shire Of Manjimup, Western Australia, 6260, Australia","Dickensen Street","Western Australia"
"956140-99999","KARNET",-32.433,116.067,"Serpentine, Shire of Serpentine-Jarrahdale, Western Australia, Australia","Serpentine","Western Australia"
"956150-99999","BEVERLEY",-32.1,116.917,"Beverley Golf Club, Forrest Street, Beverley, Shire Of Beverley, Western Australia, 6304, Australia","Beverley Golf Club","Western Australia"
"956160-99999","PINGELLY",-32.533,117.083,"Queen Street, Pingelly, Shire Of Pingelly, Western Australia, Australia","Queen Street","Western Australia"
"956170-99999","SHANNON",-34.583,116.35,"Middleton Road, Shire Of Manjimup, Western Australia, Australia","Middleton Road","Western Australia"
"956180-99999","WAGIN",-33.3,117.333,"Rifle North Street, Wagin, Shire Of Wagin, Western Australia, Australia","Rifle North Street","Western Australia"
"956200-99999","INNER DOLPHIN PYLON",-31.983,115.833,"Crawley, Perth, City of Perth, Western Australia, 6009, Australia","Crawley","Western Australia"
"956210-99999","COLLIE EAST",-33.367,116.167,"Collie River Trail, Collie, Shire Of Collie, Western Australia, 6225, Australia","Collie River Trail","Western Australia"
"956220-99999","DONNYBROOK",-33.567,115.817,"Golf Club Road, Donnybrook, Shire Of Donnybrook-Balingup, Western Australia, 6239, Australia","Golf Club Road","Western Australia"
"956230-99999","JARRAHWOOD",-33.8,115.65,"Jarrah Log Road, Yoganup, City Of Busselton, Western Australia, Australia","Jarrah Log Road","Western Australia"
"956240-99999","MERREDIN",-31.467,118.267,"Merredin-Nungarin Road, Nukarni, Merredin, Shire Of Merredin, Western Australia, 6415, Australia","Merredin-Nungarin Road","Western Australia"
"956250-99999","CUNDERDIN AIRFIELD",-31.617,117.217,"Cunderdin Airport, Aerodrome Road, Cunderdin, Shire Of Cunderdin, Western Australia, Australia","Cunderdin Airport","Western Australia"
"956260-99999","NAREMBEEN",-32.067,118.4,"Narembeen, Shire Of Narembeen, Western Australia, 6369, Australia","Narembeen","Western Australia"
"956270-99999","HYDEN COMPOSITE",-32.45,118.9,"East Hyden Bin Road, Hyden, Shire Of Kondinin, Western Australia, Australia","East Hyden Bin Road","Western Australia"
"956280-99999","ONGERUP",-33.95,118.483,"Foster Road, Mindarabin, Shire Of Gnowangerup, Western Australia, Australia","Foster Road","Western Australia"
"956310-99999","GOOMALLING",-31.3,116.833,"Goomalling Caravan Park, High Street, Goomalling, Shire Of Goomalling, Western Australia, 6460, Australia","Goomalling Caravan Park","Western Australia"
"956320-99999","BRIDGETOWN",-33.95,116.133,"Williams Street, Bridgetown, Shire Of Bridgetown-Greenbushes, Western Australia, 6255, Australia","Williams Street","Western Australia"
"956340-99999","SOUTHERN CROSS AIRFIELD",-31.233,119.35,"Rodgers Road, Southern Cross, Shire Of Yilgarn, Western Australia, Australia","Rodgers Road","Western Australia"
"956350-99999","HOPETOWN NORTH",-33.933,120.133,"Lookout Road, Hopetoun, Shire Of Ravensthorpe, Western Australia, 6348, Australia","Lookout Road","Western Australia"
"956360-99999","JACUP",-33.883,119.1,"Rabbit Proof Fence Road, Jerramungup, Shire Of Jerramungup, Western Australia, Australia","Rabbit Proof Fence Road","Western Australia"
"956370-99999","LAKE GRACE",-33.1,118.467,"Collie Lake King, Lake Grace, Shire Of Lake Grace, Western Australia, 6353, Australia","Collie Lake King","Western Australia"
"956380-99999","ESPERANCE AERO",-33.683,121.833,"Coolgardie Esperance Highway, Gibson, Shire Of Esperance, Western Australia, Australia","Coolgardie Esperance Highway","Western Australia"
"956390-99999","SALMON GUMS RES. STN",-32.983,121.617,"Salmon Gums West Road, Salmon Gums, Shire Of Esperance, Western Australia, Australia","Salmon Gums West Road","Western Australia"
"956400-99999","WANDERING",-32.667,116.667,"North Bannister-Wandering Road, Wandering, Shire Of Wandering, Western Australia, Australia","North Bannister-Wandering Road","Western Australia"
"956410-99999","WITCHCLIFFE",-34.033,115.1,"Wadandi Track, Forest Grove, Witchcliffe, Shire Of Augusta Margaret River, Western Australia, 6286, Australia","Wadandi Track","Western Australia"
"956420-99999","NORSEMAN AERO",-32.217,121.75,"Norseman, Shire Of Dundas, Western Australia, 6443, Australia","Norseman","Western Australia"
"956440-99999","MUNGLINUP WEST",-33.55,120.7,"Rawlinson Road, Munglinup, Shire Of Ravensthorpe, Western Australia, Australia","Rawlinson Road","Western Australia"
"956450-99999","CAIGUNA ASA",-32.265,125.489,"Eyre Highway, Caiguna, Cocklebiddy, Shire Of Dundas, Western Australia, Australia","Eyre Highway","Western Australia"
"956460-99999","FORREST",-30.833,128.117,"Forrest, Terry Way, Forrest, City Of Kalgoorlie-Boulder, Western Australia, Australia","Forrest","Western Australia"
"956470-99999","NORTH WALPOLE",-34.95,116.717,"Swann Road, North Walpole, Walpole, Shire Of Manjimup, Western Australia, 6398, Australia","Swann Road","Western Australia"
"956540-99999","WUDINNA AERO",-33.05,135.45,"Ucontitchie Road, Wudinna, Wudinna District Council, South Australia, 5652, Australia","Ucontitchie Road","South Australia"
"956580-99999","OLYMPIC DAM AERODROME",-30.483,136.883,"Olympic Dam Airport, Paringa Drive, Olympic Dam, Municipal Council of Roxby Downs, South Australia, Australia","Olympic Dam Airport","South Australia"
"956590-99999","MINLATON AERO",-34.75,137.517,"Bluff Road, Minlaton, Yorke Peninsula Council, South Australia, 5575, Australia","Bluff Road","South Australia"
"956600-99999","ANDAMOOKA",-30.45,137.167,"Andamooka, Pastoral Unincorporated Area, South Australia, 5722, Australia","Andamooka","South Australia"
"956610-99999","PORT LINCOLN AERO",-34.6,135.883,"Sullivan Drive, North Shields, The District Council of Lower Eyre Peninsula, South Australia, 5607, Australia","Sullivan Drive","South Australia"
"956620-99999","MINNIPA DPI",-32.85,135.15,"McKenzie Road, Minnipa, Wudinna District Council, South Australia, 5654, Australia","McKenzie Road","South Australia"
"956630-99999","CUMMINS AERO",-34.25,135.717,"Bratten Way, Kapinnie, Cummins, The District Council of Lower Eyre Peninsula, South Australia, 5631, Australia","Bratten Way","South Australia"
"956640-99999","WHYALLA",-33.059,137.514,"Whyalla Airport, Lincoln Highway, Whyalla Stuart, The Corporation of the City of Whyalla, South Australia, 5608, Australia","Whyalla Airport","South Australia"
"956660-99999","PORT AUGUSTA ARID LANDS",-32.517,137.717,"Caroona Road, Port Augusta West, Port Augusta City Council, South Australia, 5700, Australia","Caroona Road","South Australia"
"956670-99999","CLARE HIGH SCHOOL",-33.817,138.6,"Craig Hill Road, Stanley Flat, Clare, Clare and Gilbert Valleys Council, South Australia, 5453, Australia","Craig Hill Road","South Australia"
"956680-99999","GLUEPOT",-33.767,140.117,"Track 1, Gluepot, Pastoral Unincorporated Area, South Australia, 5417, Australia","Track 1","South Australia"
"956690-99999","PRICE",-34.3,138,"Price, Yorke Peninsula Council, South Australia, 5570, Australia","Price","South Australia"
"956700-99999","RAYVILLE PARK",-33.783,138.217,"High Street East, Snowtown, Wakefield Regional Council, South Australia, 5520, Australia","High Street East","South Australia"
"956710-99999","ROSEWORTHY AG COLLEGE",-34.517,138.683,"Graingers Road, Woolsheds, Wasleys, Light Regional Council, South Australia, 5400, Australia","Graingers Road","South Australia"
"956740-99999","TURRETFIELD RESEARCH CENTRE",-34.55,138.833,"Holland Road, Rosedale, Light Regional Council, South Australia, 5350, Australia","Holland Road","South Australia"
"956750-99999","BLACK POLE",-34.733,138.467,"South Australia, Australia","South Australia","South Australia"
"956760-99999","EDINBURGH",-34.703,138.621,"RAAF Base Edinburgh, Argent Road, Penfield, Adelaide, City of Playford, South Australia, 5121, Australia","RAAF Base Edinburgh","South Australia"
"956770-99999","ADELAIDE PARAFIELD",-34.793,138.633,"Parafield Airport, Kings Road, Parafield, Adelaide, City of Salisbury, South Australia, 5106, Australia","Parafield Airport","South Australia"
"956780-99999","MOUNT LOFTY",-34.967,138.7,"Bilba Track, Cleland, Adelaide Hills Council, South Australia, 5152, Australia","Bilba Track","South Australia"
"956790-99999","MOUNT TERRIBLE RADAR",-35.333,138.5,"Mount Terrible Road, Sellicks Hill, Adelaide, City of Onkaparinga, South Australia, 5174, Australia","Mount Terrible Road","South Australia"
"956870-99999","RENMARK AERO",-34.2,140.683,"Airport Road, Old Calperum, Renmark Paringa Council, South Australia, 5341, Australia","Airport Road","South Australia"
"956920-99999","POONCARIE MAIL AGENCY",-33.383,142.567,"Haverfield Street, Pooncarie, Wentworth Shire Council, New South Wales, 2648, Australia","Haverfield Street","New South Wales"
"956950-99999","WILCANNIA AERODROME AWS",-31.517,143.383,"Wilcannia-Wanaaring Road, Wilcannia, Central Darling Shire Council, New South Wales, 2836, Australia","Wilcannia-Wanaaring Road","New South Wales"
"956970-99999","IVANHOE AERODROME AWS",-32.883,144.317,"Ivanhoe, Central Darling Shire Council, New South Wales, 2878, Australia","Ivanhoe","New South Wales"
"956990-99999","WHITE CLIFFS AWS",-30.85,143.07,"White Cliffs Airport, Aerodrome Road, The Blocks, White Cliffs, Central Darling Shire Council, New South Wales, 2836, Australia","White Cliffs Airport","New South Wales"
"957040-99999","GRIFFITH AIRPORT AWS",-34.25,146.067,"Griffith Airport, Kalinda Road, Lake Wyangan, Griffith, Griffith City Council, New South Wales, 2680, Australia","Griffith Airport","New South Wales"
"957050-99999","YANCO AGRICULTURAL INSTITUTE",-34.617,146.433,"Regulator Road, Yanco, Leeton Shire Council, New South Wales, 2703, Australia","Regulator Road","New South Wales"
"957060-99999","NARRANDERA",-34.702,146.512,"Narrandera Airport, Irrigation Way, Cudgel, Narrandera, Narrandera Shire Council, New South Wales, 2703, Australia","Narrandera Airport","New South Wales"
